{
  "schemaVersion": 1,
  "outlineRevisionId": "01ARZ3NDEKTSV4RRFFQ69G5FB3",
  "storySummary": "从结果到原因再到行动",
  "targetSlideCount": 4,
  "slides": [
    {
      "outlineSlideId": "01ARZ3NDEKTSV4RRFFQ69G5FB2",
      "type": "cover",
      "title": "年度经营复盘",
      "keyPoints": [
        "结论先行"
      ],
      "sourceCitations": [
        "01ARZ3NDEKTSV4RRFFQ69G5FAZ"
      ]
    }
  ]
}
